2113	12870229_1	Seekers of Truth , Start out by watching the `` Benjamin Freedman Speaks '' video @ youtube .	train	0.0
2393	30645469_1	Yeah, but back in the day there were n't that many millions nigs and wetbacks .	train	1.0
1381	30582478_1	How much you want to bet it is n't a black male running this operation You can count on white people to be very innovative	train	1.0
5351	13501530_3	This one is within jogging distance : Police Shoot , Kill NY Fugitive In Jax Man Shot Several Times In Hail Of Gunfire POSTED : Friday , February 11 , 2011 JACKSONVILLE , Fla.	train	0.0
639	13492599_1	Well they have got to be more aware then the idiots we have over here absorbing all the bs with there little sponge brains .	train	1.0
2509	30500254_10	When she goes outside , the subhuman ape thing is usually out there .	train	1.0
256	13589144_1	This is a dynamite site I ran across about a year ago : http://www.geocities.com/yosemite/4466 / It 's about one fellows adventures at Thule Air Base back in the late 60 's .	train	0.0
5851	14017062_2	I was beaten and robbed by two natives last year and over the last couple of years I have watched downtown turn into black , brown and yellow town. the food court at Portage place has started to remind me of the creature cantina from star wars .	train	1.0
585	13473247_5	Soon in their minds it is ok to date them and have children with them thus polluting our great race and pushing us further toward extinction .	train	1.0
4061	30659678_17	Slowly being brought back into service , it is an original that belonged to a Confederate military courier post war .	train	0.0
3021	14026796_2	Hacked website ?	train	0.0
4793	13561999_1	Those who are interested in this subject and who are Sustaining Members may find the following thread to be of interest also : https : //www.stormfront.org/forum/show ... ml#post5825477	train	0.0
4304	14106754_1	Hey, I live in Illinois not too far from you. i 'm always trying to find new friends and people to hang out with , some email me sometime	train	0.0
2206	13470937_1	Stupid White Man makes vacation get away in living room .	train	0.0
1940	13342703_1	Wow!	train	0.0
4335	13388956_3	http://www.boston.com/news/local/mas ... orture ? mode = PF	train	0.0
3311	13480119_2	God bless them all , to hell with the blacks .	train	1.0
2297	14264021_2	Merry Christmas and Happy Yule !	train	0.0
3838	14299236_2	There are no dumb questions and there are plenty in this thread who will answer to the best of our abilities .	train	0.0
55	30560308_2	Such as a person with one arm , wheel chair ect .	train	0.0
686	30481076_2	He should sue for racism .	train	0.0
1946	14024401_3	Your request was misconstrued , so we all hope , but maybe focus on building the movement based on conviction , not gender .	train	0.0
3087	14098769_15	My buddy 's boat .	train	0.0
1790	13592881_1	Beautiful, I 'm so glad it went well .	train	0.0
2061	31728633_2	All there music good .	train	0.0
1460	13866649_3	You 're treading on very thin ice , jimmy .	train	0.0
4654	14418498_2	We have to fight for our survival and our future but we can have our cake and eat it too .	train	0.0
642	14412097_3	We dont go telling members to run they have to come to us and ask .	train	0.0
3246	33465976_4	Y' all have a nice day .	train	0.0
2366	14669071_1	Jesus would be very disappointed in all the so called Christians who are so supportive of Jews .	train	0.0
1192	30657972_2	I know they live in Germany .	train	0.0
3608	14665356_1	liberals hate fox news , obama hates fox news. they must be doing something at least a little bit less evil than the other stations .	train	0.0
3164	30622793_3	Arabs ?	train	0.0
2655	13480925_2	Its only 1 extra kid than we normally have and if we all do it and tell are white neighbors to do it I know it would make a difference .	train	0.0
2189	14095328_1	we're out just gotta keep looking i live in east texas out here its just as hard for us to find single white men	train	0.0
1068	30502517_2	As do blacks .	train	0.0
2628	14267659_1	I lived in texas when i was younger , i know how tough some things can get . `` rasslin animals '' is half the fun	train	0.0
465	14097203_1	I'm sure someone will come along .	train	0.0
1637	13843158_2	No white person should ever be compared to a black and other useless races .	train	1.0
2646	14097590_2	Here is the link .	train	0.0
1719	14670038_1	I did n't realize we were offending you by pointing out how often Asians and Jews get surgery to look more White .	train	1.0
706	14035837_1	Well someone needs to set one up ASAP .	train	0.0
10867	30533187_1	They mutilate their own , and they do their best to see to it that those whom they see as their goyim slaves are also marked ....	train	1.0
1362	30527903_1	Anyone have a link to watch the Rousey / Correia fight online ?	train	0.0
184	30739068_2	I 'm sure it 's all a result of discrimination .	train	0.0
4603	13422115_1	Again, every time I will see filthy comment about Georgia without providing any facts , I will respond .	train	0.0
5210	30593035_3	It looks like it 's not likely to go anywhere , but this could potentially trigger a panic buying frenzy which would make armor hard to find and jack prices thru the roof overnite .	train	0.0
2177	30706647_1	This is a forum for people who support the white nationalist cause and I am one of those people , thus I have a right to speak .	train	0.0
3054	13291349_2	Look at those pictures .	train	0.0
881	30514286_1	Watching tv or film with subtiitles is also good .	train	0.0
1299	30546907_2	Kettledrummer Elo Sambo Prussian Life Guard Hussars	train	0.0
3219	12842828_2	If I go to the east ill definitely go to budapest , feel free to pm me if you want to meet up .	train	0.0
4273	30446331_1	I always told my boys what I was taught .	train	0.0
5341	13595284_3	Are they somehow less worthy because they fought for the `` wrong '' side ? 2508	train	0.0
4543	30580366_3	Every cultured society and all things therein were created by whites .	train	1.0
7684	30428425_1	They are completely different from us and should not be living within sight of us , go back to Africa and die out .	train	1.0
1919	13288494_4	Perry Ross Schiro , 19 , of Harnett County was charged yesterday with murder in the Sept. 21 shooting death of Emily Elizabeth Haddock .	train	0.0
10076	13446781_3	When most whites today have so much white guilt laid upon them that they feel they have to act black or have sexual relations and children with blacks just to be accepted there is a problem with the white race memo .	train	1.0
1732	30392180_1	We do n't have black riots in Texas , and the blacks know why .	train	0.0
2679	13867457_3	Aragorn	train	0.0
1194	13500305_2	Now I use Soulseek ( click HERE ) for my downloading .	train	0.0
338	14034721_2	It is your family and you are their blood just avoid argue with them and humor them .	train	0.0
7078	14038941_2	That 's it I slag off anyone who did n't vote BNP or NF .	train	1.0
1020	14027556_7	Please notice as well there are none of those racist intolerant vile white people hanging about causing trouble , they were forced out long ago !	train	0.0
2175	14051885_1	When they refuse to convert to Islam they will learn at the end .	train	0.0
732	14055786_1	No, there is no logic for closing the section .	train	0.0
2035	12843051_1	Just saw an video that i would share with you guys YouTube - `` WHITE GENOCIDE IN AFRICA '' THE BEGINNING OF THE END !	train	0.0
2224	13484016_5	A non-citizen shall have no such rights , but also no such duty .	train	0.0
1884	30603485_2	17L x 6W x 10.5H.	train	0.0
1881	30491877_1	No when I was younger like 10 years old , I went to black school because my mom moved us into the ghetto because just gotten divorce from my dad .	train	0.0
1883	13618945_1	Have you heard of Ajattara Barth ?	train	0.0
1715	13501379_3	5	train	0.0
4142	13844590_1	That was a wonderful article by Kevin Myers .	train	0.0
3659	30718927_1	Ironically, I just started looking into how to get my license yesterday and then I see this post today .	train	0.0
2388	31906813_1	Ya hey der !	train	0.0
4393	13597604_2	Finns and Sweds can become even closer after this and we can start to become true brethren nations like we always should have been .	train	0.0
2443	30398448_5	In a 72 hour scenario you dont need food .	train	0.0
3237	13488763_1	ok, so do we need to kill them too or are the slavs okay ? for some reason whenever i hear the word slav , the word slobber comes to mind and i picture a slobbering half breed creature like the humpback of notre dame or Igor haha	train	1.0
242	30506355_1	I live in up state New York .	train	0.0
1	13367480_1	I wonder if one of the victims opened the door to their apartment for some reason .	train	0.0
3240	14099272_2	PM me if you want to chat .	train	0.0
3786	13480673_2	More info in the Ethnic Crime Report .	train	0.0
5031	13850109_2	Again I would not pay to see this Drug addict perform no matter how could she was a singer .	train	0.0
1749	31753065_2	I think the cop was white .	train	0.0
2528	30571520_4	Overpenetration IS a serious concern .	train	0.0
4093	14028722_4	Shocking .	train	0.0
4846	30659678_8	I can hit a paper plate at 100 yards or hole a 5 gallon steel pail of roofing tar at 25 yards ... It is my `` brush gun '' during blackpowder deer season or when going after feral hogs .	train	0.0
7986	13459510_1	Blacks seem to be hell bent on embarrassing themselves and acting like animals everywhere they go .. this is pretty typical behaviour ..	train	1.0
1872	14098701_1	Hey, I am in Mesa ..	train	0.0
3768	14267446_7	It became that way because years and years ago , joe louis ran a camp for ghetto kids there .	train	0.0
6428	13481896_1	Since they are just little kids i do n't want to be rude , but how ugly is the black kid compared to the others ? it 's not even adorable , it 's kinda scary lol	train	1.0
1249	13341044_1	Obama has membership in Prince Hall ( for blacks ) lodge and will become the next president , according to this guy : [ youtube = http://www.youtube.com/watch ? v = _ nLfRsReGII ] Zagami [ /youtube ]	train	0.0
5171	13499780_1	They do it not because of their nationalism but rather due to their hatred of Russians .	train	0.0
10579	31019775_1	I eventually came to the conclusion that jews behave more like a criminal syndicate than any respectable religion .	train	1.0
1796	13857875_1	Beware of the falling house prices that Negroes bring with them ( another reason why you 'll never find them living near politicans ) .	train	1.0
5041	12882767_3	I think I stumbled on this thread before and thought I 'd get back to it and forgot .	train	0.0
619	13586421_1	In Sweden most people receives SVT 1 , SVT 2 , TV 3 , TV 4 , Kanal 5 and ZTV SVT 1 and SVT 2 are state owned and mostly show socialistic propaganda .	train	0.0
551	30626480_1	I had nothing but polite White Children and their parents come to my door , and I got to meet some of my neighbors .	train	0.0
1313	14416429_4	Fast food is not for whites .	train	0.0
754	13059805_3	My Kansas ancestors got by during the Great Depression without eating cow dung , and everything was covered in dust then .	train	0.0
445	14297717_2	Zuul88-My cousin 's an IE Peckerwood , and i 'm a good friends with another , I live over here in san bernardino , send me a pm ?	train	0.0
778	13866670_2	Who are you ? and how did you get your hands on it ? pm me or send a email please	train	0.0
4949	14109486_1	im an irish n.s skin , id like to hear from any skin or nonskin n.s girls from around the world ! 88 ...	train	0.0
8619	14411050_2	Imagine the groids licking their big lips when they see all those unsuspecting tourists walking around .	train	1.0
2915	14075712_2	Feel free to join !!	train	0.0
4356	30659678_13	Also shoot a Lyman Great Plains .54 , patched lead round ball over bulk FFg , fired by a #11 cap .	train	0.0
1755	13507823_7	Police allege the man , described as black and between 17 and 20 , got out of his car , walked back to where Bautista was sitting and shot him .	train	0.0
5121	12858722_3	What will it look like ?	train	0.0
10100	13858462_1	One the Chinese get there teeth into a country that s it they take over .	train	1.0
1751	30673265_13	Sir Thomas Lawrence .	train	0.0
2339	30623715_7	My kids in school are only around kids born within a few months of them and they rarely get to talk .	train	0.0
2782	30667359_1	Rock music video for 12 Stones band , with truck footage .	train	0.0
3339	14102798_1	Considering this is stormfront I 'd say we are all in agreement that we highly prefer white children to anything else ....	train	0.0
4418	14418686_1	This post by Jack boot and the piece by Marc Moran , are very inspiring .	train	0.0
2221	30709717_1	They are trying to dumb us down on purpose ( said to say , it 's been working ) .	train	0.0
1750	31742982_1	Everytime I hear the word `` Yugo '' I think of that scene in Dragnet , where Sergeant Joe Friday says `` the department furnished us with a 1985 Yugo , the cutting edge of serbo-croatian technology !! ''	train	0.0
1319	30436626_1	They all look nonwhite , look closer .	train	0.0
2818	13481244_2	If that is not genocide , what is ?	train	0.0
2778	14426812_2	Also if your intrested check out our webpage for more info on our european american town we are building !	train	0.0
3205	13484169_1	That is just about as disgusting an advertisement as I have ever seen before and in fact the most disgusting thing I have seen ever .	train	0.0
1486	14030386_1	I recently watched an item on the BBC news in which a headteacher from a school in Birmingham was interviewed about a lack of funding .	train	0.0
5601	13547398_2	Shows some interesting statistics about the jew rats ...	train	1.0
2820	33676864_4	This is after a famous incident of former Prime Minister Pierre Trudeau , who gave the finger to a group of protesters who were yelling anti-french sayings at him .	train	0.0
1744	14074862_1	You mean adoption of this new found identity which in all reality is a Greek identity .	train	0.0
745	30623737_6	It features some pretty good , cutting edge anime for mature teens and adults .	train	0.0
10019	14674224_2	Any kind of civilization Negroes have today is a gift from the White race .	train	1.0
2486	30390992_1	I was born in Canada but my family is 730 + members strong and we are all from Ireland , so the heritage is thick and the pride is strong .	train	0.0
1583	14023644_2	It really would n't surprise me if 3 years marked a big change in attitudes as well as demographics	train	0.0
1326	14422121_2	He is indeed a brave man and champion of our cause .	train	0.0
1081	30444110_9	I feel as though this border should be much , much further south .	train	0.0
1050	13507823_2	The brutality of his crime and his lack of remorse made Jackson the `` model candidate for death in the gas house , '' one columnist wrote after his death sentence was upheld by the state 's highest court .	train	0.0
2550	13479789_1	I go through this thread once a week to check the links .	train	0.0
2609	30613252_1	I would love to see a video of Somalis blown apart with a torpedo and see bodies and scrap metal fly hundreds of feet into the air .	train	1.0
10932	13596651_2	They ca n't survive without us , but they do us nothing but harm .	train	1.0
4851	13485699_2	I twice went to their concert in the Olympic Stadium in Moscow - in 2010 and 2012 .	train	0.0
5602	14670190_1	Laugh it up ape cause without yt to protect your race Asians will probably do the world a favour and wipe your kind from the face of the Earth .	train	1.0
3108	13850034_2	It 'll be a welcome change to see a fellow WN from seeing hundreds of lefty bastards going to see RATM .	train	1.0
271	13460091_3	UK July 2009 .	train	0.0
8138	31000153_2	Jews are the most demanding and worst patients of all .	train	1.0
2700	14094392_2	- Karl	train	0.0
269	14420811_1	From David Pringle For folks who have questions about the National Alliance or would just like to listen this is your chance .	train	0.0
4309	30598336_1	Border fence , what border fence ?	train	0.0
1873	14666455_3	88 In the end is victory	train	0.0
2440	30756267_2	This is pretty much perversion indoctrination to kindergardeners .	train	0.0
4953	13847335_1	We have to encourage people to boycott all black businesses , start rumours that blacks working in shops have AIDs which is probably true .	train	1.0
1802	14406596_1	Might I suggest this documentary series for getting rid of europhobic tendencies ?	train	0.0
2639	14655279_2	But how does one objectively distinguish a racist white gun owner from a non racist one ?	train	0.0
2676	13866649_1	We occasionally get people like jimmy coming here to SF to `` study '' us .	train	0.0
3867	30583619_2	Does anyone have a recommendation ?	train	0.0
4528	14670178_2	Want to see our fate if we do n't win ?	train	0.0
4801	30631872_3	The fact he gave the Roman salute victoriously was priceless .	train	0.0
1596	30453341_2	There are extremely few genetic markers that are restricted to only 1 specific area , let alone 1 specific nation .	train	0.0
3358	14678722_3	I think Casablanca and Gone With The Wind are horrible movies and that The Sound Of Music is one of the most annoying things ever put to film .	train	0.0
4831	30773927_1	So how do you explain America 's being behind almost every industrialized nation in the world when it comes to education ?	train	0.0
1088	30520490_1	ive looked into classes on gunsmithing i can do basic things but i just dont have every tool for every gun on the market. and if it ever comes down to dooms day we are gonna need a good smithy	train	0.0
2213	12849464_1	Thank you for posting your story .	train	0.0
2944	31744038_1	LOL GJ brother 10 points for the Uber humans and - 10 for the sub human ape creatures you are truly one bad mofo whitey crakker man	train	1.0
3037	13290706_1	God please bless with wisdom the judge and jury against this group of thugs that they all might be hanged .	train	1.0
2129	14675480_1	The black gene always comes out to be the dominant gene .	train	0.0
9382	14013954_1	Seriously Canada would have been better off if they left the pakis at home , im like you I do n't object to asians because they at least try to fit in .	train	1.0
1414	14024252_1	Seeing the teams of white nations have black players in their ranks is a depressing site to see.They should be representing the best of our nations not the worst	train	1.0
3317	14096118_1	drinking does ease the sorrow of a lonely life .. it 's so tempting to just go out and get drunk , and laid like i did in my youth .. but i have n't got the energy for it anymore .. more likely to lie in bed and cry until it 's time to go work .. still hoping life gets better than this : drink 2508	train	0.0
174	13852694_2	IRA could have hit a prime minister at any time but chose to hit kids instead .	train	0.0
1659	30790752_1	I'm a high school senior .	train	0.0
90	13470937_4	Gatsby Coram & Stoney Westmoreland - FedEx Commercial `` Vacation at home '' - YouTube	train	0.0
3527	14096038_3	Camie	train	0.0
2135	14104331_3	~ ME	train	0.0
1826	12845096_2	Adrien Holboth Julia Kovacs Anita Salata Dora Barkaszi Zsofia Buki Beata Frank Eszter Gulyas Eniko Halasz Ramona Kiss Marta Knoll Szandra Proksa	train	0.0
5074	14112850_1	That little one is adorable !	train	0.0
3143	13491591_5	http://www.eurorus.org/	train	0.0
3098	13284941_1	Of course they do .	train	0.0
4450	30739072_4	As Hispanic and Negro populations increase test score averages will decrease .	train	1.0
1695	30404483_2	If anyone want 's to get together I 'm open to a BBQ with like-minded individuals .	train	0.0
3750	30466517_1	Hey, guys I 'm new to SF but I 've long had right wing views about immigration looking to join a white nationalist group I live in Huron county PM me if you have a group I could join or if you know of one in my area !	train	0.0
5420	30468974_2	People in Europe have nothing .	train	0.0
3548	14083587_1	Indeed.	train	0.0
533	14671829_9	Now you know why I DON' T want to attract them to our movement .	train	0.0
2739	30616591_1	You will see much worse things in the future .	train	0.0
4969	30560605_4	Ever wonder why ?	train	0.0
5463	14302069_3	There are n't any towns down here that are as clean and well kept as Kalispell .	train	0.0
9160	14659168_2	They receive housing and welfare at the taxpayer 's expense while breeding like cockroaches .	train	1.0
5224	30481231_2	If we got rid of all Asians in the country Canada would be massively white .	train	0.0
837	30507680_3	All we have is blacks and a few mestizos and all are pretty well behaved , we keep them that way around here	train	1.0
8286	13615314_1	To be honest .. i dont think this Muslim killed him because he thought the swedish boy looked like a racist ... it was probably just an excuse .	train	1.0
4884	30560740_1	This is a good thread There is a lot of cheap WHITE places to live in the U.S. I have already drivin to look at some places already .	train	0.0
5679	12843325_1	We have a little piece of legislation called the Prohibition of Foreign Military Assistance Act This prohibits mercs from operating in South Africa. on pain of five years of hell in a kaffer jail .	train	1.0
1346	13477832_2	It 's all BS anyway .	train	0.0
2290	31508132_1	My Gym teacher told a Lebanese kid that was screwing around during class to go back to his own poor ass country if he wants to screw around .	train	0.0
1185	30428490_1	I have Japanese friends online , and they think it 's pretty funny that our countries are letting themselves get * * * * ed by bull * * * * .	train	0.0
1450	30439769_2	That 's about the same as saying the sky is blue , or the grass is green .	train	0.0
3121	30794638_1	I just called her and told her next time to save it and come to me , from there we can go to my attorney and see if there is anything we can do to stir the pot .	train	0.0
22	31728633_5	88 - Jim	train	0.0
10794	13621261_8	We do n't need such scum .	train	1.0
8269	12848217_16	It wasnt really that dangerous perse , just stinky , and dumb , with the poor 5 % white kids the outcasts , which made some of them hooligans and crazy .	train	1.0
4075	14056714_2	4 hrs · In a sinister development , Waterford Against Street Crime and Organised Begging has gained support from the Nationalist Movement - an ardently fascist , racist , anti-immigration , anti-multiculturalist , Islamophobic , homophobic organisation .	train	0.0
5315	14105052_2	There are too many wonderful people on here to mention .. you will meet them soon enough .	train	0.0
1662	31786660_3	Haha !	train	0.0
3251	30713756_2	In another year I 'll have my B/S in civil engineering .	train	0.0
2441	13443527_1	Allow me to apologize for my last post , as I was drinking heavily last night but you callin me a genetic lottery winner ? come on now I 've had my fair share of hard times just last week a yellow person came into my place of work and started making trouble .	train	1.0
799	13119410_1	I guess Mr. Pena forgot about the black speed skater who won the gold and is being glorified on NBC every 5 minutes .	train	0.0
468	14434772_4	Daniel Wretström march And their website : http://www.salemfonden.info/ ( currently seems to be down but usually works just fine )	train	0.0
901	14097203_3	Hell , I 've been single for ....	train	0.0
254	14678705_2	What about peanut butter ?	train	0.0
3329	13479043_4	Two weeks before raping and killing Holly , he raped a college student .	train	0.0
9916	13641599_1	We're letting these creatures flow openly through our air and sea ports and not performing so much as a background test on them .	train	1.0
2978	14103624_1	I'm in SWVa .	train	0.0
2253	14671343_1	Indeed, so many species have been hunted to extinction .	train	0.0
4923	13398095_2	It 's embarassing .	train	0.0
3067	30423555_2	Uzi Tactical Pens Demonstration - YouTube ( I know Uzi is an Israeli company , but the video is pretty good and you can get a Smith and Wesson model. )	train	0.0
4129	13469326_1	Every Hispanic I have known is terrified of dogs and do n't like cats either .	train	0.0
4970	30571599_6	Parts are more expensive , and exclusive .	train	0.0
4388	31786685_1	AIM: hayden1488 ICQ : 156598438 MSN : hayden _ 1488 Yahoo : hayden _ 1488 Note you can also find out peoples logins for instant messager programs on our Stormfront profiles .	train	0.0
2673	30483200_2	Arthur Kemp over exaggerates their role in almost every civilization .	train	0.0
2890	14027903_1	Tens Of Millions For Africa Drought Victims A # 52.25m emergency aid package has been put together to help millions of drought victims in the Horn of Africa , the Government has announced .	train	0.0
731	13849943_1	I have been recently told that the 2nd toe , the one that rests beside the big toe is a genetic distinction if you are of Celtic Stock .	train	0.0
1558	14279550_14	MrBadgerSir	train	0.0
3888	30575690_2	May the New Year find us even more unified !	train	0.0
3730	14284623_3	32	train	0.0
4348	30636407_4	Ak47 with folding stock 4 .	train	0.0
2725	14662719_3	Leave now .	train	0.0
2254	14663523_1	Idiots like you fail to last when surrounded by your pets , The name of your alleged savior will be on your lips as you get `` diversified ''	train	0.0
2720	13458375_2	Those nogs in France do n't belong there and then they show how unruly they can be .	train	1.0
3113	13292902_1	This was just on the news : Apparently the negro left a cigarette butt behind at the other house he attempted to break in to complete with his DNA .	train	0.0
5192	13460659_1	The one thing the enemy does n't want is a motivated and unifed white world wide network that is both rich in money and ideas .	train	0.0
1265	30491857_1	I think I was my own `` tiger mom '' when in Montessori school ... around age 3 My memories are vague ( cue song ) but Mumsy said they had hoola hoops we sat in and whenever a kid stepped in mine I slapped him/her .	train	0.0
4017	13392077_1	I'm sure their failure to dig simple bloody pits for their ordure is our fault somehow .	train	0.0
9265	14029408_1	We are far closer to being neanderthals than apes .	train	1.0
4379	14267724_1	Yes, it 's time to imagine that .	train	0.0
