2101	14088622_2	I lived in a town when I was younger ( here in colorado ) It was tiny , took maybe 30 minutes to walk across the whole town .	train	0.0
571	30679934_1	the kind of perversion that leads to homosexuality also leads to pedophilia. why take the risk , and even if the homosexuals turned out not to be pedophiles why would anyone want a child to live with two perverts .	train	1.0
10116	12856933_1	It would be great if we could get every last white out of there so no one would be there to fix things .	train	1.0
3102	31711324_1	agreed, there is no reason to make genocide of other races as long as they are in another country and have nothing to do with our affairs !	train	1.0
1169	14098701_4	So IM me .	train	0.0
2313	13379549_2	US-based Human Rights Watch says thousands have been raped by rebels and soldiers in the past six months .	train	0.0
3330	14673237_1	Miami,( I do n't know how Don can stand living down there ) Hispanic - 279,456 ( 70.0 % ) Black alone - 64,993 ( 16.3 % ) White alone - 47,622 ( 11.9 % ) Asian alone - 3,649 ( 0.9 % ) Two or more races - 2,642 ( 0.7 % ) Other race alone - 676 ( 0.2 % ) American Indian alone - 361 ( 0.09 % ) Native Hawaiian and Other Pacific Islander alone - 58 ( 0.01 % ) Read more : Miami , Florida ( FL ) profile : population , maps , real estate , averages , homes , statistics , relocation , travel , jobs , hospitals , schools , crime , moving , houses , news , sex offenders	train	1.0
5425	30560348_1	Yep.	train	0.0
2529	14265938_1	The Ridge motel in Mandan/Bismarck costs $ 300 a week .	train	0.0
3848	30604519_4	My kids are grown , I would have to put them in private school if I had some now ,	train	0.0
231	14658247_2	But then I 'm half German and half German so I try to be accepting of other people with mixed backgrounds like myself .	train	0.0
191	31747401_1	a few times ive been told to make kids. i said i have no one to make them with. now i have someone but we do not feel ready to have kids. i belive in quality over quantity. so we would have maybe 2 to 4 .	train	0.0
3706	14103157_1	I am a 33 year old single white male in northern Virginia .	train	0.0
2875	30395944_2	We have plenty of articles , photos , music & we 're going to start uploading videos soon .	train	0.0
3633	12856823_2	Ukraine defense minister ignores repeated phone calls from Chuck Hagel http://washingtonexaminer.com/ukrain ... rticle/2544358	train	0.0
3288	13564132_1	Our enemy has the sheep already , and they 're doing more to destroy us than many of these `` lions '' of ours are saving .	train	0.0
4719	30468974_1	At least people in the US have guns to defend themselves .	train	0.0
3660	13855084_2	Will they ever learn ??? 16	train	0.0
5234	13490903_1	There was a study a while ago .	train	0.0
1043	14673502_1	I repped yez but must spread it around before ...	train	0.0
208	30673265_9	Sunshine .	train	0.0
3422	14105520_1	Yes the actions of a few ruin the image for the rest .	train	0.0
2392	13511770_3	See thread `` Racially motivated attacks on white teachers '' : 9 middle schoolers beat a white woman ( teacher ? ) on a bus on the way to school .	train	0.0
5196	30622793_6	This guy seems to get it but otherwise : Sorry jigs , you 're on your own	train	1.0
757	14407528_3	At times it is perplexing .	train	0.0
540	13587851_6	21325 white Estonians singing patriotic and just beautiful songs .	train	0.0
105	14105130_3	Aimee	train	0.0
796	13584961_3	Size rarely matters .	train	0.0
2747	13586421_4	The Stenbeck family also controls the Metro newspaper ( the one that you can find in many subways in big cities around the world ) .	train	0.0
8522	30395850_1	It should come as no surprise that the Jews start embracing the degeneracy that they promote ; what goes around comes around .	train	1.0
2376	13484057_1	Ariel Laurie , Israeli Soldier , Grabs Toddler in Australia Kidnaps 6 year old boy , says he 's going to put him into car trunk but mother chases him down .	train	0.0
3190	14105069_1	hey after five years of searching I finally fell in love again .	train	0.0
129	13586328_1	Now, young man !	train	0.0
6750	13405889_1	Oh, yes they will skin us alive if given the chance .	train	1.0
3147	30729191_3	Glory Glory Halliujah , Glory Glory Halliujah , Glory Glory Halliujah THe school is burning down	train	0.0
10385	13063728_1	At this point I will assume the media is lying about everything other than a Negro being arrested for his murder .	train	1.0
4198	14673538_1	I tried to sign up there once & they refused to activate my account .	train	0.0
3957	13501530_5	The U.S. Marshals Service said Barion A. Blake was killed about 12 : 30 p.m. at The Colonnade at Regency apartments in the 900 block of Monument Road .	train	0.0
3377	30636407_3	Mossberg 590a1 with bayonet 3 .	train	0.0
1769	13460091_4	YouTube - Blacks Attack White Police Officers and Citizens at Iowa State Fairgrounds YouTube - Black Man gouges out DJ 's eyes after attack .	train	0.0
1942	12872204_4	Liked the music , by the way .	train	0.0
1568	13864353_2	I heard their was 5000 people at it .	train	0.0
2429	31513229_2	And this is exactly why we have to fall back on common sense ... And common sense says nobody is hanging around below 40,000 feet to take a tan ...	train	0.0
5181	14047962_2	If anyone lives near London , ON .	train	0.0
1862	13853409_1	I never attacked you and i am not your son plus i dont care what you done.P M if you have a problem	train	0.0
1431	30638867_1	Race is a dogma on the physical world , the will of the gods and the way of the buddha is the ultimate path .	train	0.0
2024	14675480_3	Anyways , smearing a single DNA stem with black DNA is horrible .	train	1.0
2925	13582279_1	I think Fyrdung is a band which was started by members of the bands Svitjod , Pluton Svea and Division S , but I 'm not sure	train	0.0
2342	13503256_1	for all of you > > > > > serbian chetniks with german soldiers during ww2 so stop telling lies that all serbians chetniks was against nazis german soldiers	train	0.0
9667	13598214_1	As far as im concerned as soon as the little half breed is born , it should be tied round her neck and both mother and mulattoe should be flung in the nearest river.Lets see if daddy jumps in to save them !	train	1.0
3942	30587818_3	Those winchester defense loads look nasty .	train	0.0
698	13862647_1	Most of them dont even work , but I have no doubt that some of them will be pushed into high positions in society .	train	1.0
2824	12863794_2	Look at these pictures .	train	0.0
1008	30392180_5	The big black females where shouting `` We want REAL teachers for our chilrens , we do n't want dem blacks you ben sendin us , we want REAL teachers jus like yo got in dem white people 's schools ! ''	train	0.0
576	12845607_5	Lady Gaga .	train	0.0
4377	13456921_1	If not kept in check , we may very will be living in an actual Planet of the Apes soon .	train	1.0
5264	13446777_1	They're coming out of the woodwork to oppose white unity and White History Month .	train	1.0
5373	14302498_6	Frakkin ' awesome !	train	0.0
3428	13854529_1	that is absolutely * * * * ing unbelievable.they can just go route one now.no more messing about going through europe.in bongo land one minute jump on the plane and 5 hours later hop off the plane with the biggest negro smile and shout ASYLUM.i am totally depressed hearing this	train	1.0
4115	13442727_1	OK, I have been through some of the other threads on this section about NS and watched a few videos on YT .	train	0.0
1478	14417801_2	I thank you for your dedication to our cause .	train	0.0
3278	30462334_3	I knew if I waited long enough my university would eventually endorse this crap .	train	0.0
720	13165044_3	Yawn	train	0.0
1152	30382967_2	I cannot imagine how revolting it must be - the PC dialogue at your university -- idolizing athletes who dont belong in college -- white women getting pregnant with freaks	train	0.0
5389	30641955_2	John Taylor Gatto - 01 The Elite Private Boarding Schools ( I 've tried everything to get this YouTube video to imbed in this post .	train	0.0
4763	13117052_1	The media wants to bury the story because they care more about homo killers not getting their sick fetish for young boys fufilled .	train	1.0
5030	14096532_3	Oh and by the way WECOME TO STROMFRONT 100 % WHITE POWER WAR SKINS 2508	train	0.0
4290	14078628_1	Okay so if I go by that logic means you 're willing to give up that piece of land ...	train	0.0
5221	12860642_3	They are out of ideas .	train	0.0
5245	33017016_1	Fox news reported last night that this beast was caught eating parts of this young man when the police got onto the bus to apprehend him !	train	1.0
3378	14432575_1	Or a classified section for employment or contract services .	train	0.0
2651	33045544_1	Jews are not only insane , they are of literal demonic DNA .	train	1.0
2309	30535761_2	The government and elites will not do anything about it .	train	0.0
3007	13479043_5	He has two previous felony convictions for violent crimes .	train	0.0
4004	13945988_2	When there , have many children .	train	0.0
4683	13589734_1	Interesting article about what to do with these evil persons who keep telling the truth and who don ´ t want to surrender ( in Danish )	train	1.0
1467	14098605_1	Hey Frank if I wasnt on the other side of the planet would I do .	train	0.0
2252	31750726_1	yea i thought so when i saw a episode they had a klanmen on there and he was calling jerry a * * * * ing jew lol	train	0.0
4361	12851205_2	It 's why they do n't take real ones seriously .	train	0.0
8502	13843813_1	Not good news at all but this happens in all European nations and is no doubt pushed by the likes of Jews like Summer Redstone and MTV !!	train	1.0
8616	14405792_1	Latest reported attack on students by the local Negroes was on a couple out getting a pizza in the late evening hours , 4 Blacks jumped them on their walk home .	train	1.0
2321	13511105_3	http://www.wafb.com/Global/story.asp ? S = 11397795 Robinson had allegedly tried to sell the 225-pound piece of artillery , but Hurlee grew suspicious and called the Sheriff 's Office .	train	0.0
3947	30507538_1	This is a thread I created a while ago .	train	0.0
2847	13609323_2	Read the earlier posts and see that there are still lots of non-whites coming to Denmark .	train	0.0
1163	14110260_4	Einherjer88@hotmail.com	train	0.0
2422	14675423_2	Maybe it was because of his repeated personal attacks , in violation of the rules of the forum .	train	0.0
7391	14407501_1	I dont think it will work moot is too much of a libtard to allow that going on for too long	train	1.0
2204	14034954_1	London nowadays is more dangerous for tourists than Zimbabwe Like the above poster says do n't go to London just go someplace else that is much better like Bath or Stratford Upon Avon ( Shakespeare Birthplace ) Londonistan is a craphole	train	1.0
1629	14112132_1	im from nepa not looking for a relationship just someone to talk to my brother goes to ps in state college so im down there quite often xxboobearxx@aol.com	train	0.0
2881	30385379_2	I will be handing all mine over to the proper authorities .	train	0.0
965	14078802_2	Hope it 's as fast as it looks because it will have to be fast .	train	0.0
3316	13500381_2	Are there also serbs who have black hair as well ?	train	0.0
2477	30641011_2	I will have to try that and see how much force it adds !	train	0.0
984	13164557_4	Yah , I guess there is !!!	train	0.0
2839	13848611_1	If they have some marches and what not about showing pride in their culture you guys should go out and do the same If you could try and contact people you know in different cities and see if their willing to do the same .	train	0.0
2802	13457473_2	YouTube - BLACK WOMAN GOES BALLISTIC ON REPORTER YouTube - he wuz a good boy , Black kid kills two white men YouTube - Black Man Charged with Rape of 65 year old Coma Patient YouTube - BLACK Robber Forces Guy to Drink Liquid Soap Video	train	0.0
1859	30439166_1	What he means is to not directly support as far as possible , as opposed to indirectly support the system itself ( via taxes etc ) .	train	0.0
2218	14416862_2	We ought to give this material a better edge for their advancement in life , business and politics !	train	0.0
1316	14077746_4	Gyspsies !	train	0.0
3327	13292900_2	It seems that what they are trying to say is that if you are white you are in the wrong place at the wrong time anywhere in the World .	train	0.0
3127	13399720_2	http://www.whitewire.net/index.php ? p = 82#more-82 Who says that Dr. Pierce did n't accurately predict the future in the Turner Diaries ?	train	0.0
416	30703918_2	It is based on the Sven Hassel story of the same name - www.stormfront.org/forum/t1103833/	train	0.0
3935	30698757_2	They have properly learnt their Zionist lesson ...	train	0.0
8374	30679925_1	There are lots of brown and black kids in the system gays could adopt .	train	1.0
54	30622613_1	Bought the p226 today .	train	0.0
2764	14029108_2	They pretty much say if you get mugged it 's your fault .	train	0.0
5374	14064879_1	Plans for largest mosque in Ireland given go ahead Read more : Plans for largest mosque in Ireland given go ahead | Irish News | IrishCentral Follow us : @IrishCentral on Twitter | IrishCentral on Facebook	train	0.0
6215	12903858_2	Just as soon as they repay for the generations of welfare their majestic peoples have consumed .	train	1.0
4109	14097509_2	I am 24 , like to hang out in my local bar have few ones and place music as much as i can .	train	0.0
5713	14080747_1	The powers that be want all Whites dumbed down with Negro blood .	train	1.0
4847	12846163_2	Are there any majority white universities in South Africa ?	train	0.0
2160	14082538_2	It 's amazing how well dogs and cats get along when they are raised together .	train	0.0
9990	13272432_1	If it 's brown , flush it down .	train	1.0
1994	14675562_1	They almost always choose to identify with blacks more than whites .	train	0.0
872	14670842_1	Non Whites hate White people plain and simple.They are taught from birth that White people are the cause of all the problems in the world and every bad thing that happens is because of evil racist White people .	train	0.0
1243	14650949_5	Shocking and outrageous , that is what we all should be feeling. jmho b.e.	train	0.0
536	14073043_1	This gay kill a young bulgarian man to protect some criminal brown gypsy from beating This is the true face of so-called `` anti-racist '' !	train	1.0
4229	30491779_2	Sounds interesting , thanks for posting it .	train	0.0
118	30491857_3	Cats Musical - Memory - YouTube	train	0.0
3981	14072007_1	I wonder if this is the taste of what 's to come to all of Europe in a couple of decades .	train	0.0
6140	30582398_1	No, I hope the negro is not all right , ever .	train	1.0
4636	13590117_4	Står i butik ( papirforretn. ) ( The above are other people listed as living in my family 's home .	train	0.0
1376	14102718_1	lookin for white friends online ! i 'm from mexico , and i would like to meet people interested in nordic black metal and the holocaust so we can send mails to each other. : attack	train	0.0
3540	14299563_2	Thank you	train	0.0
2685	14106362_3	I already gave up on Gone With The Wind for the same reason .....	train	0.0
4965	12845600_4	Die Antwoord - `` Cookie Thumper '' ( Official Video ) - YouTube	train	0.0
317	13137240_1	Many thanks Dr. Duke on behalf of all us internet radio addicts , your DavidDuke.com interviews are always very much appreciated !	train	0.0
3206	13491591_4	Euro-Rus Евро-Русь For a great Europe , from Gibraltar to Vladivostok !	train	0.0
5580	14658183_1	As a brit my knowledge of american law is somewhat lacking but even i know that this holder groid has committed treason	train	1.0
3939	13285941_3	Had to make it up that is why	train	0.0
459	14098052_1	Very nice I have a problem with clutter in my room , I would need to throw a hell of a lot out to make mine over but good job	train	0.0
166	30534328_2	Lying Marxists !	train	1.0
2681	14072773_1	I have no idea .	train	0.0
2586	14110260_2	I 'm more into wolves than lions .	train	0.0
891	30432059_1	It is about time damn it If we keep listening to the damn Ass teachers we are going to change from Aryan to Airy Einstein is Airy want us to believe in time travel and hooking up a hose to the sky to funnel dark energy when the damn professors funneling funds and teaching Einstein 's stupidity I can prove Einstein stupid and I tried to meet David Duke to end Einstein and he did not reply Any History makers ?	train	0.0
4709	13463245_1	Help me send a message to Obama : https : //petitions.whitehouse.gov/pet ... istan/SZP82fbc https : //petitions.whitehouse.gov/pet ... ation/PLzLzpnc https : //petitions.whitehouse.gov/pet ... -iran/Gs7L50Kv https : //petitions.whitehouse.gov/pet ... h-irs/s8XQx9Hs https : //petitions.whitehouse.gov/pet ... tates/nzjYDlGM	train	0.0
10526	12904919_1	Here is a video of the event that is worth watching just to see a beautiful White lady screaming `` scum , scum , scum , f * * * ing scum !!! '' at the muslim filth .	train	1.0
5449	13594695_3	I think character and social behavior are the most important , and having blond hair and blue eyes are not going to gaurantee these qualities .	train	0.0
4597	30466508_2	You can click `` New Posts '' on the red bar before you wanna create a new thread to see if the news was already posted or not .	train	0.0
750	30782213_1	I know the thing on ebay said its first edition so i guess so , its still sitting at 51 $ so i am hoping it stays there and ill just bid like crazy the last few minutes of the auction and hopefully get it .	train	0.0
2043	14412294_2	Many nazis just sit on their asses , drink beer and watch TV .	train	0.0
2340	30680055_3	Hell to have a teacher like this .	train	1.0
3122	14426972_1	I stop on BET sometimes to reassure my desires to fight their progression and get in the know about their latest crap .	train	0.0
4331	12854837_4	I think VHS tapes are available at Amazon .	train	0.0
1044	14111061_1	KC skin boy looking for KC skin girl .	train	0.0
178	30514286_2	www.third-reich-books.com - English translations of hundreds of Third Reich originals without negative commentary !	train	0.0
8849	13164372_3	Except , of course , for those that pander to the filthy sons and daughters of Satan like ' ol Sandra here .	train	1.0
1953	13587148_2	2508	train	0.0
656	30436626_2	You can see injun features .	train	0.0
5072	14056592_2	And they really are quite a frustrated group .	train	0.0
6132	13858316_1	The worst thing about the present immigration is that it 's spread all over the country .	train	1.0
4656	30777604_2	I 'm sure I would have done great in public school if the Mexican gang members stopped kicking my * * * long enough for me to get my homework done ...	train	1.0
2872	14411099_1	So long as http://ghettobraggingrights.wordpress.com/ exists I will not only think of blacks as sub-human savage beasts with no more self-control than a rabid dog , but refer to them as such .	train	1.0
1934	30587819_5	Stay for Gel test .	train	0.0
588	30790770_1	Little Miss Little Miss Muffet sat on a tuffet Eating a Big Mac and fries Along came a spider and sat down beside her ' Yuck ' , it said , ' I prefer flies ' .	train	0.0
8412	14406890_2	Stop race mixing and discourage those who practice it .	train	1.0
3141	14420048_1	I made copies and passed em out to friends and family .	train	0.0
620	30687831_1	i was a bmxer for a while until it got stolen by SOMEONE ... but i turned my attention to mountain bikes ... i like em you can actualy go places not just do stupid dog tricks	train	0.0
2640	14081124_1	I'm not running and giving it to the muds .	train	1.0
2698	31114067_1	did Hitler not have a policy that only those with blue eyes would have lived ? brown hair was acceptable , only with blue eyes .	train	0.0
5003	14093667_1	these are two pictures of me , l am a proud Croatian redneck , l drink rakija , eat lamb and get in fights as often as l can and l go to the gym once a week , yihaa !!!!!!	train	0.0
3478	13842818_1	They have been taking advantage of our over-welcoming nature for far to long .	train	1.0
2789	13598771_2	Oh wait , that never happened ...	train	0.0
4350	30558564_2	By the time I was growing up in the 2000s and early 2010s the area was already mixed and a few shops closed down .	train	0.0
4344	30560348_3	It failed due to lack of funding .	train	0.0
3967	12856199_2	Richard Anthony March 2 , 2014 A Storm is Brewing on the Horizon ?	train	0.0
2815	31741895_1	I am sorry to hear that about losing your job well after reading all of these i went out walking cuz i was pumped to kick some ass .. heh ...	train	0.0
9608	13640781_1	Its only a matter of time until we become a hell hole like Sweden or the UK .	train	1.0
10414	30694638_2	Why would I want to contribute to the Kneegrow and spic 's wellbeing ?	train	1.0
60	14412097_2	We will be announcing congressional candidates and local office candidates in a few months .	train	0.0
4956	14090065_1	haha; im a 19 y.o white male from newcastle area - but im moving back to sydney very soon ( west sydney im afraid lol )	train	0.0
568	31775627_1	theres this girl at my school and she is really tall and she is the darkes * * * * * * ive ever saw and she sat by me and i moved too the next table and she had a bag of cookies and she could not open it so she was trying to open with her teeth like a dog slaping it back in foruth finlly this white trash girl opened with her mouth then she had the nerve to spit on a white girl and thegirl did nothing but smile and then this mixed kid had the neve to ask me out i told him no and go to hell. this was my day at school suced huh. hope you tyep back sorry for spelling .	train	0.0
3000	14040183_1	I can vouch for Blades and bows I have done business with them many times and customer service brilliant if you got a problem they will sort it .	train	0.0
508	30560311_2	I 'm surprised they 're not holding the gun back to front .	train	1.0
3522	30566602_1	could you upload a pic of this amazing set up ?	train	0.0
1592	13587460_2	The downfall has begun ...	train	0.0
2246	14111748_2	I 've added you to my AIM but have yet to catch you online .	train	0.0
1622	13164557_1	I think I 'll get me a couple of these things .	train	0.0
2635	14301771_6	http://www.frontlinesourcegroup.com/ ... FSiCQgo * * * * AGw http://www.jobs-to-careers.com/index...FcKDQgodVk4ANQhttp://www.indeed.com/q-Temp-l-Conroe,-TX-jobs.html	train	0.0
5432	12882767_2	I especially like the news stories told un-PC .	train	0.0
3456	13427417_2	Too bad 98 percent of public school kids are being taught everything BUT the truth .	train	0.0
7337	30394464_2	And here 's what David Irving 's site offers on Hitler 's Table Talks .	train	1.0
887	30684884_1	My new word o ' the week ( which has somehow become the word o ' two weeks ) : torpid : tor * pid adj : 1 ) Dormant ; hibernating .	train	0.0
3252	31783631_1	I am 18 from chicago. i would like to chat with someone via EMAIl or AIM to chat about your beliefs and mine ... someone near my age also. my AIM screen name is eldawg4100	train	0.0
4372	31752038_1	Ill shave my head when I finally get my 5 GCSE grades at C or above .	train	0.0
1736	14299829_1	Where in Alabama are you ?	train	0.0
170	13851581_1	A crude drawing of a swastika on a wall with spraypaint will only make neutral people associate nazi 's with common lowlife scum .	train	0.0
2078	14013941_1	I finally heard back from the Child Development today .	train	0.0
4371	13504486_1	2-Year-Old Dies Of Rape , Mammy 's Boonfren ' Charged - NNN Reporters Newsroom Forum Dekalb 2-Year-Old Dead ; Caregiver Charged Police Say Child Was Abused POSTED : 10 : 41 pm EDT October 2 , 2010 UPDATED : 11 : 51 pm EDT October 3 , 2010 Dekalb 2-Year-Old Dead ; Caregiver Charged - DeKalb County Headlines News Story - WGCL Atlanta	train	0.0
3253	13864997_1	It's no surprise Irish girls would do that .	train	0.0
1193	30560311_1	Honestly if they ever fired them I 'd expect they 'd do more damage to themselves since the average negro lacks the intellect for basic firearms training .	train	1.0
3787	12872207_1	Please, enough of the Finno-Ugric fairy tale https : //www.stormfront.org/forum/t416643 / https : //www.stormfront.org/forum/t69616 / And here is a Khanty song for comparison Khanty song `` Akem ar '' ( `` Old Man 's Song '' ) - YouTube	train	0.0
1030	13507823_3	Jackson 's retrial took jurors back to the events of late summer 1977 , when two widows , Vernita Curtis , 81 and Gladys Ott , 90 , were beaten and strangled to death during burglaries a week apart in a Long Beach apartment building .	train	0.0
737	14104912_1	Welcome to Stormfront and please do n't sell your chances short !	train	0.0
2896	13466582_2	Dreaming of a Future World ( Full Version ) - YouTube Dr William Pierce .	train	0.0
2046	14667003_1	Aren't u tired of ur propaganda ??	train	0.0
7186	13061354_2	They would be better off just sitting out in the sun eating a dirt sundae .	train	1.0
5200	14097927_1	Yes most certainly now you need to recruit more of you friends an such to join Stormfront and help our movement !	train	0.0
9348	14665709_1	I've heard that men with AIDS in Africa think having sex with a virgin will cure them .	train	1.0
4477	13628191_1	Not just that , but many people who adopt kids are capable of making their own pure white children .	train	0.0
832	13621261_6	The Chechen beast was one of those who committed killing in the name of Allah against our Russian brothers , like the theater in Moskva .	train	1.0
2545	31944563_1	It's being reported by some of the British press who are usually more critical of Israel .	train	0.0
4421	13488032_2	So lets kill all the whites there because every single one of them is a ZOG agent , even the children !	train	0.0
3444	30617967_2	This is your only choice , White man !	train	0.0
1371	30653614_1	Homosexuals ca n't undo the fight against White Genocide , only hypocrites can , I 'd rather have openly homosexual men on our side than closet fags or sexual deviants who skulk about pretending to be something they 're not .	train	1.0
